<?xml version="1.0" encoding="UTF-8"?>

<purchaseOrder xmlns:xsi="http://www.w3.org/2001/XMLSchema-instance"
 xsi:noNamespaceSchemaLocation="purchaseOrder.xsd" orderDate="2000-01-01"> 

    <shipTo country="US">
        <name></name>
        <street></street>
        <city></city>
        <state></state>
        <zip>14.300</zip>
    </shipTo>

    <billTo country="US">
        <name></name>
        <street></street>
        <city></city>
        <state></state>
        <zip>15.300</zip>
    </billTo>

    <comment>Holaaa</comment>

    <items>
        <item partNum="123-AV">
            <productName></productName>
            <quantity>33</quantity>
            <USPrice>23</USPrice>
            <comment></comment>
            <shipDate>2014-02-12</shipDate>
        </item>
    </items>



</purchaseOrder>