<purchaseOrder xmlns:xsi="http://www.w3.org/2001/XMLSchema-instance"
 xsi:noNamespaceSchemaLocation="purchaseorder.xsd">
    <shipTo>
        <name></name>
        <street></street>
        <city></city>
        <state></state>
        <zip>12.300</zip>
    </shipTo>
    <billTo>
        <name></name>
        <street></street>
        <city></city>
        <state></state>
        <zip>13.223</zip>
    </billTo>
    <comment></comment>
    <items>
        <!-- <item partNum="235-HD" isOutDate="false">
            <productName></productName>
            <quantity>1</quantity>
            <USPrice>20</USPrice>
            <comment>Important</comment>
            <shipDate>2000-01-01</shipDate>
        </item> -->
        <service>
        Web pages development
        </service>
    </items>

</purchaseOrder>

<!-- Enumerados para atributos y choice para los elmentos REVISAR!!!-->